{
    "$schema": "schema.json",
    "domain": "industry_features",
    "description": "Curated AI/tech capability landscape. Cross-cutting features that apply across providers, tools, and frameworks. These inform what morphism Programs need to support.",
    "last_curated": "2026-03-14",
    "categories": {
        "model_capabilities": [
            {
                "id": "ind:feat:streaming",
                "name": "Streaming",
                "description": "Token-by-token response delivery via SSE/WebSocket",
                "related_skills": [
                    "websocket-engineer"
                ]
            },
            {
                "id": "ind:feat:tool-use",
                "name": "Tool Use / Function Calling",
                "description": "LLM generates structured tool invocations from context",
                "related_skills": [
                    "mcp-integration-expert",
                    "mcp-developer"
                ]
            },
            {
                "id": "ind:feat:vision",
                "name": "Vision / Multimodal",
                "description": "Image understanding alongside text",
                "related_skills": [
                    "ai-vision"
                ]
            },
            {
                "id": "ind:feat:audio",
                "name": "Audio Processing",
                "description": "Speech-to-text, text-to-speech, audio analysis"
            },
            {
                "id": "ind:feat:extended-thinking",
                "name": "Extended Thinking / Reasoning",
                "description": "Chain-of-thought with verification loops (o1-style)"
            },
            {
                "id": "ind:feat:embeddings",
                "name": "Embeddings",
                "description": "Dense vector representations for semantic search",
                "related_skills": [
                    "rag-architect"
                ]
            },
            {
                "id": "ind:feat:moe",
                "name": "Mixture of Experts (MoE)",
                "description": "Sparse MoE transformer architecture — activates subset of parameters per token. DeepSeek, Llama 4, Phi-3.5-MoE"
            },
            {
                "id": "ind:feat:million-token-context",
                "name": "Million-Token Context",
                "description": "2M+ token context windows (Gemini 3.x). Enables full-codebase and document-set processing"
            },
            {
                "id": "ind:feat:edge-inference",
                "name": "Edge Inference",
                "description": "On-device model serving via GGML/llama.cpp, Granite 1B Speech, quantized models. GGML joined HuggingFace (Mar 2026)"
            }
        ],
        "rag_retrieval": [
            {
                "id": "ind:feat:vector-search",
                "name": "Vector Search",
                "description": "Approximate nearest neighbor over embedding space",
                "related_skills": [
                    "rag-architect"
                ]
            },
            {
                "id": "ind:feat:reranking",
                "name": "Reranking",
                "description": "Cross-encoder refinement of initial retrieval results"
            },
            {
                "id": "ind:feat:hybrid-search",
                "name": "Hybrid Search",
                "description": "Combined keyword (BM25) + vector search"
            },
            {
                "id": "ind:feat:grounding",
                "name": "Grounding",
                "description": "Provider-side retrieval (Google Grounding, Bing search)"
            }
        ],
        "training_adaptation": [
            {
                "id": "ind:feat:fine-tuning",
                "name": "Fine-Tuning",
                "description": "Full or parameter-efficient model adaptation",
                "related_skills": [
                    "fine-tuning-expert"
                ]
            },
            {
                "id": "ind:feat:lora",
                "name": "LoRA / QLoRA",
                "description": "Low-rank adapter training for efficient fine-tuning",
                "related_skills": [
                    "fine-tuning-expert"
                ]
            },
            {
                "id": "ind:feat:rlhf",
                "name": "RLHF / DPO",
                "description": "Reinforcement learning from human feedback / Direct preference optimization"
            }
        ],
        "operational": [
            {
                "id": "ind:feat:rate-limiting",
                "name": "Rate Limiting",
                "description": "Request throttling per API key/org/tier",
                "related_skills": [
                    "api-gateway-patterns"
                ]
            },
            {
                "id": "ind:feat:cost-tracking",
                "name": "Cost Tracking",
                "description": "Token-level cost accounting per request"
            },
            {
                "id": "ind:feat:caching",
                "name": "Response Caching",
                "description": "Semantic or exact-match response cache for cost reduction"
            },
            {
                "id": "ind:feat:batching",
                "name": "Request Batching",
                "description": "Bulk inference for throughput optimization"
            }
        ],
        "agent_patterns": [
            {
                "id": "ind:feat:agent-loop",
                "name": "Agent Loop",
                "description": "Observe-think-act cycle with tool calling and memory"
            },
            {
                "id": "ind:feat:memory-management",
                "name": "Memory Management",
                "description": "Context window optimization, conversation history, long-term memory"
            },
            {
                "id": "ind:feat:multi-agent",
                "name": "Multi-Agent",
                "description": "Coordinated agent teams with delegation and handoff"
            },
            {
                "id": "ind:feat:code-execution",
                "name": "Code Execution",
                "description": "Sandboxed runtime for generated code verification"
            },
            {
                "id": "ind:feat:context-engineering",
                "name": "Context Engineering",
                "description": "Structured context window management — prompt composition, memory injection, retrieval orchestration (PRECEPT framework)"
            },
            {
                "id": "ind:feat:agent-rl",
                "name": "Agent Reinforcement Learning",
                "description": "RL-based agent training for tool use and task completion. Forge (MiniMax), OpenAI RL approaches"
            },
            {
                "id": "ind:feat:multi-agent-orchestration",
                "name": "Multi-Agent Orchestration",
                "description": "Framework-level coordination of multiple agents with A2A protocol, delegation, state sharing"
            },
            {
                "id": "ind:feat:identity-protocol",
                "name": "Identity Protocol",
                "description": "Agent identity and authentication standards (LDP-based, EPOCH protocol)"
            }
        ],
        "observability": [
            {
                "id": "ind:feat:tracing",
                "name": "Distributed Tracing",
                "description": "Request-level trace propagation across services",
                "related_skills": [
                    "monitoring-expert",
                    "sre-engineer"
                ]
            },
            {
                "id": "ind:feat:logging",
                "name": "Structured Logging",
                "description": "JSON/structured log emission with correlation IDs"
            },
            {
                "id": "ind:feat:metrics",
                "name": "Metrics Collection",
                "description": "Prometheus-style counters, histograms, gauges",
                "related_skills": [
                    "monitoring-expert"
                ]
            }
        ]
    }
}