{
    "$schema": "schema.json",
    "domain": "industry_frameworks",
    "description": "Curated development framework landscape by domain. Each entry is an industry entity classifiable by the superset as OBJ04 (AppTemplate) when instantiated as a template pattern.",
    "last_curated": "2026-03-11",
    "domains": {
        "backend": [
            {
                "id": "ind:framework:fastapi",
                "name": "FastAPI",
                "language": "Python",
                "style": "async-first",
                "related_skills": [
                    "fastapi-development",
                    "fastapi-expert",
                    "fastapi-microservices-development"
                ]
            },
            {
                "id": "ind:framework:django",
                "name": "Django",
                "language": "Python",
                "style": "batteries-included",
                "related_skills": [
                    "django-expert"
                ]
            },
            {
                "id": "ind:framework:flask",
                "name": "Flask",
                "language": "Python",
                "style": "micro",
                "related_skills": [
                    "python-pro"
                ]
            },
            {
                "id": "ind:framework:express",
                "name": "Express.js",
                "language": "JavaScript",
                "style": "minimal",
                "related_skills": [
                    "nodejs-development"
                ]
            },
            {
                "id": "ind:framework:nestjs",
                "name": "NestJS",
                "language": "TypeScript",
                "style": "opinionated-modular",
                "related_skills": [
                    "nestjs-expert"
                ]
            },
            {
                "id": "ind:framework:spring-boot",
                "name": "Spring Boot",
                "language": "Java",
                "style": "enterprise",
                "related_skills": [
                    "spring-boot-engineer",
                    "java-architect"
                ]
            },
            {
                "id": "ind:framework:rails",
                "name": "Ruby on Rails",
                "language": "Ruby",
                "style": "convention-over-config",
                "related_skills": [
                    "rails-expert"
                ]
            },
            {
                "id": "ind:framework:laravel",
                "name": "Laravel",
                "language": "PHP",
                "style": "elegant-expressive",
                "related_skills": [
                    "laravel-specialist"
                ]
            },
            {
                "id": "ind:framework:aspnet",
                "name": "ASP.NET Core",
                "language": "C#",
                "style": "cross-platform",
                "related_skills": [
                    "dotnet-core-expert",
                    "csharp-developer"
                ]
            },
            {
                "id": "ind:framework:go-stdlib",
                "name": "Go Standard Library",
                "language": "Go",
                "style": "minimal-explicit",
                "related_skills": [
                    "golang-backend-development",
                    "golang-pro"
                ]
            },
            {
                "id": "ind:framework:actix",
                "name": "Actix Web",
                "language": "Rust",
                "style": "actor-based",
                "related_skills": [
                    "rust-engineer"
                ]
            },
            {
                "id": "ind:framework:gin",
                "name": "Gin",
                "language": "Go",
                "style": "minimal-fast",
                "related_skills": [
                    "golang-pro"
                ]
            }
        ],
        "frontend": [
            {
                "id": "ind:framework:react",
                "name": "React",
                "language": "TypeScript/JavaScript",
                "style": "component-hooks",
                "related_skills": [
                    "react-expert",
                    "practical-react-query"
                ]
            },
            {
                "id": "ind:framework:vue",
                "name": "Vue.js",
                "language": "TypeScript/JavaScript",
                "style": "composition-api",
                "related_skills": [
                    "vue-expert",
                    "vue-expert-js"
                ]
            },
            {
                "id": "ind:framework:angular",
                "name": "Angular",
                "language": "TypeScript",
                "style": "opinionated-enterprise",
                "related_skills": [
                    "angular-architect"
                ]
            },
            {
                "id": "ind:framework:nextjs",
                "name": "Next.js",
                "language": "TypeScript",
                "style": "fullstack-ssr",
                "related_skills": [
                    "nextjs-developer"
                ]
            },
            {
                "id": "ind:framework:svelte",
                "name": "Svelte/SvelteKit",
                "language": "JavaScript",
                "style": "compiled",
                "related_skills": []
            },
            {
                "id": "ind:framework:blazor",
                "name": "Blazor",
                "language": "C#",
                "style": "wasm-or-server",
                "related_skills": [
                    "vsa-ui-enhancer",
                    "vsa-boundary-modeler"
                ]
            }
        ],
        "mobile": [
            {
                "id": "ind:framework:flutter",
                "name": "Flutter",
                "language": "Dart",
                "style": "widget-tree",
                "related_skills": [
                    "flutter-expert"
                ]
            },
            {
                "id": "ind:framework:react-native",
                "name": "React Native",
                "language": "TypeScript/JavaScript",
                "style": "bridge-native",
                "related_skills": [
                    "react-native-expert"
                ]
            },
            {
                "id": "ind:framework:swiftui",
                "name": "SwiftUI",
                "language": "Swift",
                "style": "declarative",
                "related_skills": [
                    "swift-expert"
                ]
            }
        ],
        "data": [
            {
                "id": "ind:framework:pandas",
                "name": "Pandas",
                "language": "Python",
                "style": "dataframe",
                "related_skills": [
                    "pandas-pro"
                ]
            },
            {
                "id": "ind:framework:spark",
                "name": "Apache Spark",
                "language": "Scala/Python/Java",
                "style": "distributed",
                "related_skills": [
                    "spark-engineer"
                ]
            },
            {
                "id": "ind:framework:dbt",
                "name": "dbt",
                "language": "SQL/Jinja",
                "style": "transform-in-warehouse",
                "related_skills": [
                    "sql-pro"
                ]
            }
        ],
        "ml_ai": [
            {
                "id": "ind:framework:pytorch",
                "name": "PyTorch",
                "language": "Python",
                "style": "eager-mode",
                "related_skills": [
                    "ml-pipeline",
                    "fine-tuning-expert"
                ]
            },
            {
                "id": "ind:framework:tensorflow",
                "name": "TensorFlow",
                "language": "Python",
                "style": "graph-mode",
                "related_skills": [
                    "ml-pipeline"
                ]
            },
            {
                "id": "ind:framework:transformers",
                "name": "Hugging Face Transformers",
                "language": "Python",
                "style": "pretrained-pipelines",
                "related_skills": [
                    "fine-tuning-expert",
                    "rag-architect"
                ]
            },
            {
                "id": "ind:framework:langchain",
                "name": "LangChain",
                "language": "Python/TypeScript",
                "style": "agent-chain",
                "related_skills": [
                    "rag-architect"
                ]
            }
        ]
    }
}