{
    "$schema": "schema.json",
    "domain": "industry_compute",
    "description": "Curated compute resource landscape. Each entry is an industry entity classified by the superset as OBJ10 (ComputeResource). Covers GPU, cloud, edge, and orchestration platforms.",
    "last_curated": "2026-03-11",
    "categories": {
        "gpu": [
            {
                "id": "ind:gpu:nvidia-h100",
                "name": "NVIDIA H100",
                "vendor": "NVIDIA",
                "architecture": "Hopper",
                "vram_gb": 80,
                "fp16_tflops": 989,
                "status": "current"
            },
            {
                "id": "ind:gpu:nvidia-h200",
                "name": "NVIDIA H200",
                "vendor": "NVIDIA",
                "architecture": "Hopper",
                "vram_gb": 141,
                "fp16_tflops": 989,
                "status": "current"
            },
            {
                "id": "ind:gpu:nvidia-b200",
                "name": "NVIDIA B200",
                "vendor": "NVIDIA",
                "architecture": "Blackwell",
                "vram_gb": 192,
                "fp16_tflops": 2250,
                "status": "upcoming"
            },
            {
                "id": "ind:gpu:nvidia-a100",
                "name": "NVIDIA A100",
                "vendor": "NVIDIA",
                "architecture": "Ampere",
                "vram_gb": 80,
                "fp16_tflops": 312,
                "status": "current"
            },
            {
                "id": "ind:gpu:amd-mi300x",
                "name": "AMD MI300X",
                "vendor": "AMD",
                "architecture": "CDNA 3",
                "vram_gb": 192,
                "fp16_tflops": 1300,
                "status": "current"
            },
            {
                "id": "ind:gpu:google-tpuv5e",
                "name": "Google TPU v5e",
                "vendor": "Google",
                "architecture": "TPU",
                "vram_gb": 16,
                "fp16_tflops": 197,
                "status": "current"
            }
        ],
        "cloud_compute": [
            {
                "id": "ind:cloud:aws-ec2",
                "name": "AWS EC2",
                "provider": "AWS",
                "type": "vm",
                "notes": "GPU instances: p5 (H100), p4d (A100), g5 (A10G)"
            },
            {
                "id": "ind:cloud:aws-lambda",
                "name": "AWS Lambda",
                "provider": "AWS",
                "type": "serverless",
                "notes": "Event-driven, max 15min, 10GB memory"
            },
            {
                "id": "ind:cloud:gcp-cloud-run",
                "name": "GCP Cloud Run",
                "provider": "GCP",
                "type": "container-serverless",
                "notes": "Autoscaling containers, GPU support coming"
            },
            {
                "id": "ind:cloud:gcp-vertex",
                "name": "GCP Vertex AI",
                "provider": "GCP",
                "type": "ml-platform",
                "notes": "Managed model serving, training, pipelines"
            },
            {
                "id": "ind:cloud:azure-container-apps",
                "name": "Azure Container Apps",
                "provider": "Azure",
                "type": "container-serverless",
                "notes": "Dapr sidecar, event-driven scaling"
            },
            {
                "id": "ind:cloud:azure-functions",
                "name": "Azure Functions",
                "provider": "Azure",
                "type": "serverless",
                "notes": "Durable patterns, event grid triggers"
            }
        ],
        "edge_wasm": [
            {
                "id": "ind:edge:wasmtime",
                "name": "Wasmtime",
                "type": "wasm-runtime",
                "notes": "Bytecode Alliance reference runtime"
            },
            {
                "id": "ind:edge:wazero",
                "name": "wazero",
                "type": "wasm-runtime",
                "notes": "Pure Go WebAssembly runtime — zero dependencies"
            },
            {
                "id": "ind:edge:cloudflare-workers",
                "name": "Cloudflare Workers",
                "type": "edge-serverless",
                "notes": "V8 isolates, global edge network"
            }
        ],
        "orchestration": [
            {
                "id": "ind:orch:kubernetes",
                "name": "Kubernetes",
                "type": "container-orchestration",
                "related_skills": [
                    "kubernetes-specialist"
                ],
                "notes": "De facto standard for container orchestration"
            },
            {
                "id": "ind:orch:docker-compose",
                "name": "Docker Compose",
                "type": "container-orchestration",
                "related_skills": [
                    "docker-compose-orchestration"
                ],
                "notes": "Single-machine multi-container development"
            },
            {
                "id": "ind:orch:nomad",
                "name": "HashiCorp Nomad",
                "type": "workload-orchestration",
                "related_skills": [],
                "notes": "Lightweight alternative to K8s — containers, VMs, exec"
            }
        ]
    }
}